{
  "storyId": "-md-ai-184614",
  "sectionNumber": "1",
  "userAnswers": {
    "had_changed": "changed",
    "allowed": "has allowed",
    "had_dreamed": "",
    "was": "",
    "asked": "",
    "explained": "",
    "was_1": "",
    "came": "came",
    "logged": ""
  },
  "correctAnswers": {
    "had_changed": "had changed",
    "allowed": "allowed",
    "had_dreamed": "had dreamed",
    "was": "was",
    "asked": "asked",
    "explained": "explained",
    "was_1": "was",
    "came": "came",
    "logged": "logged"
  },
  "feedback": "---\ntitle: \"Анализ раздела: Времена глаголов\"\ntype: \"section-explanation\"\nscore: \"1/9\"\ntimestamp: \"2025-08-03T10:25:43.740Z\"\n---\n\n## Анализ ваших ответов\nВаш результат в разделе \"Времена глаголов\" составляет 1 из 9 правильных ответов, что означает, что осталось много работы для улучшения понимания времён. Однако с каждым шагом вы приближаетесь к цели. Процент правильных ответов составляет примерно 11%, что указывает на то, что вам необходимо более глубоко изучить грамматические правила и практиковать их применение.\n\n## Разбор ошибок\nДавайте рассмотрим каждую ошибку подробнее:\n- Для \"had_changed\" ваш выбор был \"changed\", но правильный ответ - \"had changed\". Это связано с использованием прошедшего совершенного времени, которое показывает, что одно действие было завершено до другого действия в прошлом.\n- Для \"allowed\" вы выбрали \"has allowed\", но правильный ответ - \"allowed\". Здесь правильным временем является простое прошедшее время, поскольку действие произошло в прошлом без дополнительных уточнений.\n- В случаях \"had_dreamed\", \"was\", \"asked\", \"explained\", \"was_1\" и \"logged\" вы не предоставили ответа. Это говорит о том, что вам необходимо больше практики в выборе правильных времён глаголов в предложениях.\n \n## Грамматические правила\nВажно понять основные грамматические правила для каждого времени, которое встретилось в разделе:\n- **Прошедшее совершенное время** (had + глагол в форме прошедшего участия) используется для описания действия, которое произошло до другого действия в прошлом. Пример: \"I had eaten before I went to the cinema.\"\n- **Простое прошедшее время** (глагол в форме прошедшего времени) используется для описания действия, которое произошло в определённый момент в прошлом. Пример: \"I went to the park yesterday.\"\n- **Настоящее совершенное время** (has/have + глагол в форме прошедшего участия) используется для описания действия, которое началось в прошлом и продолжается до настоящего момента. Пример: \"I have been studying English for three years.\"\n\n## Рекомендации для изучения\nДля улучшения ваших навыков в использовании времён глаголов рекомендую следующее:\n- Практикуйте перевод предложений из вашего родного языка на английский, используя разные времена.\n- Изучайте грамматические правила и примеры каждого времени, которое встретилось в разделе.\n- Используйте онлайн-ресурсы или упражнения, которые фокусируются на временах глаголов, для более глубокой практики.\n- Регулярно повторяйте пройденный материал, чтобы закрепить знания и избежать забывания.",
  "timestamp": "2025-08-03T10:27:51.143Z"
}